2025-09-20,1576,Scottish League One,0.0,0.0,28680.0,32785.0,34744291,Queen of South v Inverness CT
2025-09-20,1577,English National League North,0.0,0.0,28680.0,32785.0,34744712,Hereford FC v Worksop Town
2025-09-20,1578,English National League North,100.0,100.0,28780.0,32885.0,34744714,Scarborough Athletic v Oxford City
2025-09-20,1579,English National League North,100.0,100.0,28880.0,32985.0,34744747,Chorley v Macclesfield
2025-09-20,1580,Bolivian Liga de Futbol Profesional,0.0,0.0,28880.0,32985.0,34745502,Club Independiente Petrol v San Antonio Bulo Bulo
2025-09-20,1581,Bolivian Liga de Futbol Profesional,0.0,0.0,28880.0,32985.0,34745503,Oriente Petrolero v Nacional Potosi
2025-09-20,1582,Romanian Liga II,100.0,100.0,28980.0,33085.0,34747896,CS Tunari v CS Afumati
2025-09-20,1583,Venezuelan Primera Division,0.0,0.0,28980.0,33085.0,34747944,Estudiantes de Merida v Portuguesa FC
2025-09-20,1584,Venezuelan Primera Division,0.0,0.0,28980.0,33085.0,34747948,Caracas v Zamora FC
2025-09-20,1585,Northern Irish Premiership,100.0,100.0,29080.0,33185.0,34751478,Larne v Carrick Rangers
2025-09-20,1586,Northern Irish Premiership,0.0,0.0,29080.0,33185.0,34751481,Crusaders v Ballymena
2025-09-20,1587,Northern Irish Premiership,0.0,0.0,29080.0,33185.0,34751512,Linfield v Glenavon
2025-09-20,1588,Northern Irish Premiership,0.0,0.0,29080.0,33185.0,34751535,Dungannon v Cliftonville
2025-09-20,1589,Venezuelan Primera Division,0.0,0.0,29080.0,33185.0,34751893,Rayo Zuliano v Monagas
2025-09-20,1590,English Premier League 2 - Div 1,0.0,0.0,29080.0,33185.0,34751988,Arsenal U21 v Wolves U21
2025-09-21,1591,French Ligue 1,0.0,0.0,29080.0,33185.0,34683105,Monaco v Metz
2025-09-21,1592,French Ligue 1,0.0,0.0,29080.0,33185.0,34683115,Paris FC v Strasbourg
2025-09-21,1593,French Ligue 1,-240.0,-240.0,28840.0,32945.0,34683124,Le Havre v Lorient
2025-09-21,1594,French Ligue 1,100.0,100.0,28940.0,33045.0,34683128,Auxerre v Toulouse
2025-09-21,1595,Dutch Eredivisie,-260.0,-260.0,28680.0,32785.0,34683148,AZ Alkmaar v Feyenoord
2025-09-21,1596,Dutch Eredivisie,0.0,0.0,28680.0,32785.0,34683152,Heerenveen v NEC Nijmegen
2025-09-21,1597,Dutch Eredivisie,0.0,0.0,28680.0,32785.0,34683153,PEC Zwolle v Go Ahead Eagles
2025-09-21,1598,German Bundesliga,0.0,0.0,28680.0,32785.0,34683482,Eintracht Frankfurt v Union Berlin
2025-09-21,1599,Greek Super League,100.0,200.0,28780.0,32985.0,34684416,Panathinaikos v Olympiakos
2025-09-21,1600,Greek Super League,100.0,100.0,28880.0,33085.0,34684422,Levadiakos v OFI
2025-09-21,1601,Brazilian Serie A,0.0,0.0,28880.0,33085.0,34687245,SE Palmeiras v Fortaleza EC
2025-09-21,1602,Brazilian Serie A,0.0,0.0,28880.0,33085.0,34687246,Internacional v Gremio
2025-09-21,1603,Brazilian Serie A,0.0,0.0,28880.0,33085.0,34687251,Flamengo v Vasco da Gama
2025-09-21,1604,Brazilian Serie A,100.0,100.0,28980.0,33185.0,34687436,Sport Recife v Corinthians
2025-09-21,1605,Brazilian Serie A,100.0,100.0,29080.0,33285.0,34687442,Cruzeiro MG v Bragantino SP
2025-09-21,1606,Brazilian Serie A,100.0,100.0,29180.0,33385.0,34687456,Santos v Sao Paulo
2025-09-21,1607,Danish Superliga,0.0,0.0,29180.0,33385.0,34732331,Vejle v SonderjyskE
2025-09-21,1608,Swedish Allsvenskan,0.0,0.0,29180.0,33385.0,34732335,Hammarby v Hacken
2025-09-21,1609,Swedish Allsvenskan,0.0,0.0,29180.0,33385.0,34732342,IFK Goteborg v Brommapojkarna
2025-09-21,1610,Swedish Allsvenskan,0.0,0.0,29180.0,33385.0,34732343,Sirius v Degerfors
2025-09-21,1611,Danish Superliga,0.0,0.0,29180.0,33385.0,34732397,FC Copenhagen v Silkeborg
2025-09-21,1612,Belgian First Division A,-250.0,-250.0,28930.0,33135.0,34732761,Yellow-Red Mechelen v Cercle Brugge
2025-09-21,1613,Belgian First Division A,0.0,0.0,28930.0,33135.0,34732762,Genk v Union St Gilloise
2025-09-21,1614,Belgian First Division A,0.0,0.0,28930.0,33135.0,34732763,Club Brugge v Sint Truiden
2025-09-21,1615,German Bundesliga 2,0.0,0.0,28930.0,33135.0,34734223,Holstein Kiel v Karlsruhe
2025-09-21,1616,German Bundesliga 2,0.0,0.0,28930.0,33135.0,34734247,Fortuna Dusseldorf v SV Darmstadt
2025-09-21,1617,German Bundesliga 2,0.0,0.0,28930.0,33135.0,34734332,Dynamo Dresden v Hannover
2025-09-21,1618,Slovenian Premier League,0.0,0.0,28930.0,33135.0,34734523,Mura v NK Radomlje
2025-09-21,1619,Indonesian Super League,0.0,0.0,28930.0,33135.0,34734692,PSM Makassar v Persija Jakarta
2025-09-21,1620,English WSL,0.0,0.0,28930.0,33135.0,34734699,Chelsea (W) v Leicester City (W)
2025-09-21,1621,Belgian First Division B,0.0,0.0,28930.0,33135.0,34734729,Kortrijk v Club Brugge B
2025-09-21,1622,Belgian First Division B,0.0,0.0,28930.0,33135.0,34734731,Waasland-Beveren v SC Lokeren-Temse
2025-09-21,1623,Norwegian Eliteserien,100.0,100.0,29030.0,33235.0,34734863,Stromsgodset v Sarpsborg
2025-09-21,1624,Norwegian Eliteserien,0.0,0.0,29030.0,33235.0,34734872,Viking v Molde
2025-09-21,1625,Norwegian Eliteserien,0.0,0.0,29030.0,33235.0,34734883,Tromso v Ham-Kam
2025-09-21,1626,Croatian 1 HNL,100.0,100.0,29130.0,33335.0,34735377,HNK Gorica v Slaven Belupo
2025-09-21,1627,Norwegian Eliteserien,0.0,0.0,29130.0,33335.0,34735454,Kristiansund v Haugesund
2025-09-21,1628,Norwegian Eliteserien,0.0,0.0,29130.0,33335.0,34735459,Rosenborg v Bodo Glimt
2025-09-21,1629,Brazilian Serie A,0.0,0.0,29130.0,33335.0,34735569,Mirassol v Juventude
2025-09-21,1630,Slovenian Premier League,0.0,0.0,29130.0,33335.0,34736255,NK Primorje v NK Celje
2025-09-21,1631,Cypriot 1st Division,0.0,0.0,29130.0,33335.0,34737812,Omonia FC Aradippou v Paphos FC
2025-09-21,1632,Japanese J League 3,0.0,0.0,29130.0,33335.0,34741708,Kamatamare Sanuki v Sagamihara
2025-09-21,1633,Serbian Super League,100.0,100.0,29230.0,33435.0,34742048,Cukaricki v FK Backa Topola
2025-09-21,1634,English WSL,0.0,0.0,29230.0,33435.0,34742056,Brighton (W) v West Ham United (W)
2025-09-21,1635,Serbian Super League,100.0,100.0,29330.0,33535.0,34742372,FK IMT Novi Beograd v Radnicki Nis
2025-09-21,1636,German 3 Liga,100.0,100.0,29430.0,33635.0,34742840,SSV Ulm v Jahn Regensburg
2025-09-21,1637,Bolivian Liga de Futbol Profesional,100.0,100.0,29530.0,33735.0,34746511,Guabira v The Strongest
2025-09-21,1638,Bolivian Liga de Futbol Profesional,0.0,0.0,29530.0,33735.0,34746806,Always Ready v Jorge Wilstermann
2025-09-21,1639,Estonian Premier League,0.0,0.0,29530.0,33735.0,34749222,Parnu JK Vaprus v Tallinna Kalev
2025-09-21,1640,Venezuelan Primera Division,0.0,0.0,29530.0,33735.0,34752044,Deportivo La Guaira v Yaracuyanos
2025-09-21,1641,Venezuelan Primera Division,-240.0,-480.0,29290.0,33255.0,34752046,Deportivo Tachira v Puerto Cabello
2025-09-21,1642,English Premier League 2 - Div 1,0.0,0.0,29290.0,33255.0,34755124,Liverpool U21 v Man Utd U21
2025-09-24,1643,Dutch Eredivisie,0.0,0.0,29290.0,33255.0,34734039,Az Alkmaar v PEC Zwolle
2025-09-24,1644,Brazilian Serie A,-200.0,-200.0,29090.0,33055.0,34738884,Gremio v Botafogo FR
2025-09-24,1645,Brazilian Serie A,100.0,100.0,29190.0,33155.0,34738919,Vasco da Gama v Bahia
2025-09-24,1646,Swedish Superettan,100.0,100.0,29290.0,33255.0,34747134,IK Brage v Sundsvall
2025-09-24,1647,Swedish Superettan,-240.0,-240.0,29050.0,33015.0,34747138,Landskrona v Kalmar FF
2025-09-24,1648,Swedish Superettan,-240.0,-240.0,28810.0,32775.0,34747139,Orebro v Varbergs BoIS
2025-09-24,1649,Swedish Superettan,-229.99999999999997,-229.99999999999997,28580.0,32545.0,34747968,Oddevold v Falkenbergs
2025-09-24,1650,Belgian First Division B,100.0,200.0,28680.0,32745.0,34752210,Club Brugge B v Lommel
2025-09-24,1651,Belgian First Division B,-225.0,-225.0,28455.0,32520.0,34752223,SC Lokeren-Temse v Eupen
2025-09-24,1652,Belgian First Division B,100.0,100.0,28555.0,32620.0,34752231,FC Liege v Waasland-Beveren
2025-09-24,1653,Belgian First Division A,0.0,0.0,28555.0,32620.0,34753201,Club Brugge v Westerlo
2025-09-24,1654,Bolivian Liga de Futbol Profesional,100.0,100.0,28655.0,32720.0,34760819,Nacional Potosi v CD Gualberto Villarroel
2025-09-24,1655,Bolivian Liga de Futbol Profesional,100.0,100.0,28755.0,32820.0,34760828,Jorge Wilstermann v Blooming Santa Cruz
2025-09-24,1656,Serbian Super League,-270.0,-270.0,28485.0,32550.0,34766483,FK Novi Pazar v FK Radnicki 1923
2025-09-25,1657,Swedish Superettan,0.0,0.0,28485.0,32550.0,34751520,Umea FC v Vasteras SK
2025-09-25,1658,Swedish Superettan,100.0,100.0,28585.0,32650.0,34751522,Sandvikens v Helsingborgs
2025-09-25,1659,Swedish Superettan,100.0,100.0,28685.0,32750.0,34751528,Trelleborgs v Orgryte
2025-09-25,1660,Swedish Superettan,100.0,100.0,28785.0,32850.0,34751533,Ostersunds FK v Utsiktens
2025-09-25,1661,Indonesian Super League,100.0,100.0,28885.0,32950.0,34752086,Bhayangkara FC v Malut United
2025-09-25,1662,Indonesian Super League,-225.0,-225.0,28660.0,32725.0,34754907,PSBS Biak Numfor v Madura Utd
2025-09-25,1663,Bolivian Liga de Futbol Profesional,100.0,100.0,28760.0,32825.0,34760833,Real Tomayapo v Always Ready
2025-09-25,1664,Bolivian Liga de Futbol Profesional,100.0,100.0,28860.0,32925.0,34760859,San Antonio Bulo Bulo v The Strongest
2025-09-25,1665,Jordanian Premier League,0.0,0.0,28860.0,32925.0,34770810,Shabab Al Ordon v Al Ahli Amman
2025-09-25,1666,Jordanian Premier League,0.0,0.0,28860.0,32925.0,34770832,Al Buqaa v Al Hussein
2025-09-26,1667,Chilean Primera Division,0.0,0.0,28860.0,32925.0,34712733,Colo Colo v Deportes Iquique
2025-09-26,1668,Dutch Eredivisie,0.0,0.0,28860.0,32925.0,34733993,FC Twente v Fortuna Sittard
2025-09-26,1669,French Ligue 1,0.0,0.0,28860.0,32925.0,34734494,Strasbourg v Marseille
2025-09-26,1670,German Bundesliga,0.0,0.0,28860.0,32925.0,34735332,Bayern Munich v Werder Bremen
2025-09-26,1671,Dutch Eerste Divisie,0.0,0.0,28860.0,32925.0,34753260,RKC Waalwijk v ADO Den Haag
2025-09-26,1672,Saudi Professional League,0.0,0.0,28860.0,32925.0,34753262,Dhamk v Al-Ettifaq
2025-09-26,1673,Belgian First Division A,0.0,0.0,28860.0,32925.0,34753284,Oud-Heverlee Leuven v Anderlecht
2025-09-26,1674,Swiss Challenge League,0.0,0.0,28860.0,32925.0,34753524,Etoile Carouge v Aarau
2025-09-26,1675,Swiss Challenge League,0.0,0.0,28860.0,32925.0,34753525,Rapperswil-Jona v Neuchatel Xamax
2025-09-26,1676,German Bundesliga 2,0.0,0.0,28860.0,32925.0,34753859,Schalke 04 v Greuther Furth
2025-09-26,1677,German Bundesliga 2,0.0,0.0,28860.0,32925.0,34753865,SV Darmstadt v Dynamo Dresden
2025-09-26,1678,Indonesian Super League,0.0,0.0,28860.0,32925.0,34754911,Dewa United FC v Persebaya Surabaya
2025-09-26,1679,Indonesian Super League,0.0,0.0,28860.0,32925.0,34755281,Semen Padang v Bali Utd Pusam
2025-09-26,1680,Northern Irish Premiership,0.0,0.0,28860.0,32925.0,34756322,Bangor v Linfield
2025-09-26,1681,Dutch Eerste Divisie,0.0,0.0,28860.0,32925.0,34756533,Helmond Sport v FC Eindhoven
2025-09-26,1682,Saudi Professional League,0.0,0.0,28860.0,32925.0,34756534,Al-Ittihad v Al Nassr
2025-09-26,1683,Irish Division 1,0.0,0.0,28860.0,32925.0,34756660,Dundalk v UCD
2025-09-26,1684,Irish Division 1,0.0,0.0,28860.0,32925.0,34756664,Bray Wanderers v Longford
2025-09-26,1685,Japanese J League 3,0.0,0.0,28860.0,32925.0,34758660,Vanraure Hachinohe v Kagoshima Utd
2025-09-26,1686,Dutch Eerste Divisie,0.0,0.0,28860.0,32925.0,34758800,FC Dordrecht v De Graafschap
2025-09-26,1687,Dutch Eerste Divisie,0.0,0.0,28860.0,32925.0,34758806,Almere City v Jong FC Utrecht
2025-09-26,1688,Dutch Eerste Divisie,0.0,0.0,28860.0,32925.0,34758811,Den Bosch v Jong AZ Alkmaar
2025-09-26,1689,Dutch Eerste Divisie,0.0,0.0,28860.0,32925.0,34758822,Jong Ajax Amsterdam v VVV Venlo
2025-09-26,1690,Slovenian Premier League,0.0,0.0,28860.0,32925.0,34759365,NK Aluminij v NK Radomlje
2025-09-26,1691,German 3 Liga,0.0,0.0,28860.0,32925.0,34759539,Cottbus v Stuttgart II
2025-09-26,1692,Bolivian Liga de Futbol Profesional,0.0,0.0,28860.0,32925.0,34761141,CDT Real Oruro v Guabira
2025-09-26,1693,Irish Division 1,0.0,0.0,28860.0,32925.0,34761158,Cobh Ramblers v Finn Harps
2025-09-26,1694,Irish Division 1,0.0,0.0,28860.0,32925.0,34761159,Athlone Town v Wexford F.C
2025-09-26,1695,Irish Division 1,0.0,0.0,28860.0,32925.0,34761160,Kerry FC v Treaty United
2025-09-26,1696,Swedish Division 1,0.0,0.0,28860.0,32925.0,34762407,Lunds BK v Rosengard
2025-09-26,1697,Norwegian 2nd Division,0.0,0.0,28860.0,32925.0,34763299,Sandvikens v Sotra SK
2025-09-26,1698,Estonian Premier League,0.0,0.0,28860.0,32925.0,34763812,Tammeka Tartu v Kuressaare
2025-09-26,1699,Croatian 1 HNL,0.0,0.0,28860.0,32925.0,34763887,Varazdin v Vukovar
2025-09-26,1700,Swedish Division 1,0.0,0.0,28860.0,32925.0,34771994,United IK Nordic v Vasalunds IF
2025-09-26,1701,English Premier League 2 - Div 1,0.0,0.0,28860.0,32925.0,34774736,Nottingham Forest U21 v Aston Villa U21
2025-09-26,1702,English Premier League 2 - Div 1,0.0,0.0,28860.0,32925.0,34774737,West Ham U21 v Brighton U21
2025-09-26,1703,English Premier League 2 - Div 1,0.0,0.0,28860.0,32925.0,34774738,Birmingham U21 v Fulham U21
2025-09-26,1704,English Premier League 2 - Div 1,0.0,0.0,28860.0,32925.0,34774739,Middlesbrough U21 v Everton U21
2025-09-26,1705,English Premier League 2 - Div 1,0.0,0.0,28860.0,32925.0,34774742,Burnley U21 v Sunderland U21
2025-09-26,1706,English Premier League 2 - Div 1,0.0,0.0,28860.0,32925.0,34774743,Derby U21 v Arsenal U21
2025-09-26,1707,English Premier League 2 - Div 1,0.0,0.0,28860.0,32925.0,34774747,Man City U21 v Southampton U21
2025-09-26,1708,English Premier League 2 - Div 1,0.0,0.0,28860.0,32925.0,34774749,Reading U21 v Newcastle U21
2025-09-26,1709,Jordanian Premier League,0.0,0.0,28860.0,32925.0,34774876,Al Ramtha v Al-Jazeera
2025-09-27,1710,Dutch Eredivisie,100.0,100.0,28960.0,33025.0,34733986,Heracles v Sparta Rotterdam
2025-09-27,1711,Dutch Eredivisie,0.0,0.0,28960.0,33025.0,34733987,Ajax v NAC Breda
2025-09-27,1712,Dutch Eredivisie,100.0,100.0,29060.0,33125.0,34734014,FC Volendam v PEC Zwolle
2025-09-27,1713,French Ligue 1,0.0,0.0,29060.0,33125.0,34734485,Lorient v Monaco
2025-09-27,1714,French Ligue 1,0.0,0.0,29060.0,33125.0,34734492,Toulouse v Nantes
2025-09-27,1715,Greek Super League,0.0,0.0,29060.0,33125.0,34734636,Olympiakos v Levadiakos
2025-09-27,1716,German Bundesliga,0.0,0.0,29060.0,33125.0,34735326,FC Heidenheim v Augsburg
2025-09-27,1717,German Bundesliga,0.0,0.0,29060.0,33125.0,34735333,Wolfsburg v RB Leipzig
2025-09-27,1718,German Bundesliga,0.0,0.0,29060.0,33125.0,34735343,St Pauli v Leverkusen
2025-09-27,1719,German Bundesliga,100.0,100.0,29160.0,33225.0,34735352,Mgladbach v Eintracht Frankfurt
2025-09-27,1720,Brazilian Serie A,-229.99999999999997,-229.99999999999997,28930.0,32995.0,34738914,Juventude v Internacional
2025-09-27,1721,Brazilian Serie A,100.0,100.0,29030.0,33095.0,34738915,Fortaleza EC v Sport Recife
2025-09-27,1722,Brazilian Serie A,100.0,100.0,29130.0,33195.0,34738959,Vasco Da Gama v Cruzeiro MG
2025-09-27,1723,German Bundesliga 2,0.0,0.0,29130.0,33195.0,34755155,Paderborn v Kaiserslautern
2025-09-27,1724,English Sky Bet League 1,0.0,0.0,29130.0,33195.0,34755264,Leyton Orient v Stevenage
2025-09-27,1725,English Sky Bet League 2,0.0,0.0,29130.0,33195.0,34755291,Crewe v Notts Co
2025-09-27,1726,Danish Superliga,0.0,0.0,29130.0,33195.0,34755307,SonderjyskE v FC Copenhagen
2025-09-27,1727,English Sky Bet League 1,0.0,0.0,29130.0,33195.0,34755308,AFC Wimbledon v Wycombe
2025-09-27,1728,German 3 Liga,0.0,0.0,29130.0,33195.0,34755309,Schweinfurt v Alemannia Aachen
2025-09-27,1729,Belgian First Division A,0.0,0.0,29130.0,33195.0,34755318,Standard v Club Brugge
2025-09-27,1730,English Sky Bet League 2,0.0,0.0,29130.0,33195.0,34755371,Oldham v Barnet
2025-09-27,1731,Belgian First Division A,100.0,100.0,29230.0,33295.0,34755566,Zulte-Waregem v Antwerp
2025-09-27,1732,English Sky Bet League 2,100.0,100.0,29330.0,33395.0,34755569,Gillingham v Harrogate Town
2025-09-27,1733,English Sky Bet League 2,0.0,0.0,29330.0,33395.0,34755570,Chesterfield v Newport County
2025-09-27,1734,English Sky Bet League 2,100.0,100.0,29430.0,33495.0,34755574,Bristol Rovers v Salford City
2025-09-27,1735,English Sky Bet League 2,100.0,200.0,29530.0,33695.0,34755575,Accrington v Walsall
2025-09-27,1736,English Sky Bet League 2,-210.0,-420.0,29320.0,33275.0,34755577,Tranmere v Cambridge Utd
2025-09-27,1737,English Sky Bet League 2,100.0,100.0,29420.0,33375.0,34755588,Swindon v Bromley
2025-09-27,1738,English Sky Bet League 2,0.0,0.0,29420.0,33375.0,34755589,Grimsby v Cheltenham
2025-09-27,1739,English Sky Bet League 1,100.0,100.0,29520.0,33475.0,34755735,Burton Albion v Plymouth
2025-09-27,1740,English Sky Bet League 1,100.0,200.0,29620.0,33675.0,34755738,Barnsley v Port Vale
2025-09-27,1741,English Sky Bet League 1,100.0,100.0,29720.0,33775.0,34756071,Exeter v Huddersfield
2025-09-27,1742,English Sky Bet League 1,-280.0,-280.0,29440.0,33495.0,34756073,Stockport v Reading
2025-09-27,1743,English Sky Bet League 1,100.0,200.0,29540.0,33695.0,34756075,Bradford v Blackpool
2025-09-27,1744,English Sky Bet League 1,100.0,100.0,29640.0,33795.0,34756076,Luton v Doncaster
2025-09-27,1745,English Sky Bet League 1,0.0,0.0,29640.0,33795.0,34756082,Wigan v Cardiff
2025-09-27,1746,English Sky Bet League 1,100.0,200.0,29740.0,33995.0,34756114,Northampton v Bolton
2025-09-27,1747,English Sky Bet League 1,100.0,100.0,29840.0,34095.0,34756115,Peterborough v Lincoln
2025-09-27,1748,Belgian First Division A,0.0,0.0,29840.0,34095.0,34756121,Union St Gilloise v Westerlo
2025-09-27,1749,English Sky Bet League 1,100.0,100.0,29940.0,34195.0,34756136,Mansfield v Rotherham
2025-09-27,1750,English Sky Bet League 2,100.0,100.0,30040.0,34295.0,34756152,Crawley Town v Barrow
2025-09-27,1751,English Sky Bet League 2,100.0,100.0,30140.0,34395.0,34756158,Fleetwood Town v Colchester
2025-09-27,1752,Swiss Super League,100.0,200.0,30240.0,34595.0,34756161,Lugano v Grasshoppers Zurich
2025-09-27,1753,Swiss Super League,0.0,0.0,30240.0,34595.0,34756177,Servette v Winterthur
2025-09-27,1754,Northern Irish Premiership,0.0,0.0,30240.0,34595.0,34756181,Coleraine v Carrick Rangers
2025-09-27,1755,Swiss Challenge League,-275.0,-275.0,29965.0,34320.0,34756380,Stade Lausanne-Ouchy v FC Vaduz
2025-09-27,1756,Swiss Super League,100.0,100.0,30065.0,34420.0,34756649,FC Zurich v St Gallen
2025-09-27,1757,German Bundesliga 2,100.0,100.0,30165.0,34520.0,34757394,Bochum v Fortuna Dusseldorf
2025-09-27,1758,German Bundesliga 2,0.0,0.0,30165.0,34520.0,34757395,Elversberg v Holstein Kiel
2025-09-27,1759,German Bundesliga 2,0.0,0.0,30165.0,34520.0,34757396,Karlsruhe v FC Magdeburg
2025-09-27,1760,Romanian Liga II,0.0,0.0,30165.0,34520.0,34758532,Metalul Buzau v CSM Satu Mare
2025-09-27,1761,Romanian Liga II,0.0,0.0,30165.0,34520.0,34758534,CS Afumati v Concordia Chiajna
2025-09-27,1762,Romanian Liga II,0.0,0.0,30165.0,34520.0,34758650,ACS Muscelul Campulung Elite v FC Hunedoara
2025-09-27,1763,Belgian First Division B,100.0,100.0,30265.0,34620.0,34758858,Kortrijk v Eupen
2025-09-27,1764,Romanian Liga II,0.0,0.0,30265.0,34620.0,34758993,CSM Slatina v CS FC Dinamo Bucuresti
2025-09-27,1765,Belgian First Division B,100.0,200.0,30365.0,34820.0,34758998,KFCO Beerschot Wilrijk v SC Lokeren-Temse
2025-09-27,1766,Norwegian Eliteserien,0.0,0.0,30365.0,34820.0,34759000,Sarpsborg v Viking
2025-09-27,1767,German 3 Liga,0.0,0.0,30365.0,34820.0,34759207,Duisburg v Ingolstadt
2025-09-27,1768,German 3 Liga,0.0,0.0,30365.0,34820.0,34759208,Hansa Rostock v TSV Havelse
2025-09-27,1769,English WSL,0.0,0.0,30365.0,34820.0,34759483,Arsenal (W) v Aston Villa (W)
2025-09-27,1770,Swedish Allsvenskan,0.0,0.0,30365.0,34820.0,34759541,Elfsborg v Degerfors
2025-09-27,1771,Swedish Allsvenskan,0.0,0.0,30365.0,34820.0,34759571,Hacken v Norrkoping
2025-09-27,1772,Slovenian Premier League,100.0,100.0,30465.0,34920.0,34760592,Domzale v NK Primorje
2025-09-27,1773,Slovenian Premier League,100.0,100.0,30565.0,35020.0,34760594,NK Celje v NK Maribor
2025-09-27,1774,Bolivian Liga de Futbol Profesional,100.0,100.0,30665.0,35120.0,34760865,Club Independiente Petrolero v Real Tomayapo
2025-09-27,1775,Bolivian Liga de Futbol Profesional,100.0,100.0,30765.0,35220.0,34760872,Aurora v Nacional Potosi
2025-09-27,1776,Romanian Liga II,0.0,0.0,30765.0,35220.0,34760912,FC Voluntari v CSM Scolar Resita
2025-09-27,1777,Dutch Eerste Divisie,100.0,100.0,30865.0,35320.0,34761469,Vitesse Arnhem v Willem II
2025-09-27,1778,Belgian First Division B,0.0,0.0,30865.0,35320.0,34762144,Waasland-Beveren v Seraing Utd
2025-09-27,1779,Indonesian Super League,0.0,0.0,30865.0,35320.0,34762700,Persita Tangerang v Persib Bandung
2025-09-27,1780,Japanese J League 3,0.0,0.0,30865.0,35320.0,34762839,Azul Claro Numazu v FC Gifu
2025-09-27,1781,Japanese J League 3,0.0,0.0,30865.0,35320.0,34762840,Nara Club v FC Osaka
2025-09-27,1782,Japanese J League 3,0.0,0.0,30865.0,35320.0,34762841,Kitakyushu v Kochi Univ
2025-09-27,1783,Japanese J League 3,0.0,0.0,30865.0,35320.0,34762842,Kanazawa v Kamatamare Sanuki
2025-09-27,1784,Japanese J League 3,0.0,0.0,30865.0,35320.0,34763053,Thespakusatsu Gunma v Sagamihara
2025-09-27,1785,Japanese J League 3,0.0,0.0,30865.0,35320.0,34763065,Tegevajaro Miyazaki v FC Ryukyu
2025-09-27,1786,Scottish League One,0.0,0.0,30865.0,35320.0,34763533,Inverness CT v East Fife
2025-09-27,1787,Cypriot 1st Division,0.0,0.0,30865.0,35320.0,34763871,Digenis Ypsona v AEK Larnaca
2025-09-27,1788,Scottish League One,100.0,100.0,30965.0,35420.0,34765249,Hamilton v Stenhousemuir
2025-09-27,1789,Scottish League One,100.0,100.0,31065.0,35520.0,34769001,Cove Rangers v Kelty Hearts
2025-09-27,1790,Scottish League One,100.0,100.0,31165.0,35620.0,34769003,Montrose v Queen of South
2025-09-27,1791,Serbian Super League,0.0,0.0,31165.0,35620.0,34770879,Vojvodina v Zeleznicar Pancevo
2025-09-27,1792,English Premier League 2 - Div 1,0.0,0.0,31165.0,35620.0,34778252,Chelsea U21 v Stoke U21
2025-09-27,1793,Kazakhstan Premier League,0.0,0.0,31165.0,35620.0,34778492,FK Aktobe v FK Kyzyl-Zhar
2025-09-27,1794,English Premier League 2 - Div 1,0.0,0.0,31165.0,35620.0,34778720,Man Utd U21 v Crystal Palace U21
2025-09-28,1795,Chilean Primera Division,-250.0,-500.0,30915.0,35120.0,34712615,La Serena v Universidad de Chile
2025-09-28,1796,Dutch Eredivisie,100.0,100.0,31015.0,35220.0,34733989,NEC Nijmegen v AZ Alkmaar
2025-09-28,1797,Dutch Eredivisie,100.0,200.0,31115.0,35420.0,34733995,FC Groningen v Feyenoord
2025-09-28,1798,Dutch Eredivisie,100.0,100.0,31215.0,35520.0,34734006,SC Telstar v Go Ahead Eagles
2025-09-28,1799,Dutch Eredivisie,-280.0,-280.0,30935.0,35240.0,34734021,FC Utrecht v Heerenveen
2025-09-28,1800,French Ligue 1,-280.0,-280.0,30655.0,34960.0,34734480,Nice v Paris FC
2025-09-28,1801,French Ligue 1,-229.99999999999997,-459.99999999999994,30425.0,34500.0,34734490,Metz v Le Havre
2025-09-28,1802,French Ligue 1,100.0,100.0,30525.0,34600.0,34734491,Lille v Lyon
2025-09-28,1803,French Ligue 1,-250.0,-500.0,30275.0,34100.0,34734500,Rennes v Lens
2025-09-28,1804,Greek Super League,100.0,100.0,30375.0,34200.0,34734625,OFI v Kifisia
2025-09-28,1805,Greek Super League,0.0,0.0,30375.0,34200.0,34734627,AEK Athens v NFC Volos
2025-09-28,1806,Greek Super League,0.0,0.0,30375.0,34200.0,34734639,Panaitolikos v Panathinaikos
2025-09-28,1807,Greek Super League,-290.0,-290.0,30085.0,33910.0,34734642,Asteras Tripolis v PAOK
2025-09-28,1808,German Bundesliga,100.0,100.0,30185.0,34010.0,34735329,FC Koln v Stuttgart
2025-09-28,1809,German Bundesliga,-260.0,-260.0,29925.0,33750.0,34735330,Freiburg v Hoffenheim
2025-09-28,1810,German Bundesliga,-260.0,-260.0,29665.0,33490.0,34735341,Union Berlin v Hamburger SV
2025-09-28,1811,Brazilian Serie A,100.0,100.0,29765.0,33590.0,34738978,Atletico MG v Mirassol
2025-09-28,1812,Brazilian Serie A,100.0,100.0,29865.0,33690.0,34738995,Fluminense v Botafogo FR
2025-09-28,1813,Brazilian Serie A,-220.00000000000003,-220.00000000000003,29645.0,33470.0,34738998,Red Bull Bragantino v Santos
2025-09-28,1814,Brazilian Serie A,100.0,100.0,29745.0,33570.0,34739001,Bahia v SE Palmeiras
2025-09-28,1815,Brazilian Serie A,100.0,100.0,29845.0,33670.0,34739878,Corinthians v Flamengo
2025-09-28,1816,Danish Superliga,0.0,0.0,29845.0,33670.0,34756130,Viborg v Fredericia
2025-09-28,1817,Norwegian Eliteserien,0.0,0.0,29845.0,33670.0,34756186,Brann v Fredrikstad
2025-09-28,1818,Danish Superliga,-260.0,-260.0,29585.0,33410.0,34756979,Silkeborg v Vejle
2025-09-28,1819,Swedish Superettan,-250.0,-250.0,29335.0,33160.0,34759177,Varbergs BoIS v Oddevold
2025-09-28,1820,German Bundesliga 2,100.0,100.0,29435.0,33260.0,34759181,Hannover v Arminia Bielefeld
2025-09-28,1821,Swedish Allsvenskan,100.0,200.0,29535.0,33460.0,34759282,Brommapojkarna v Mjallby
2025-09-28,1822,Swiss Super League,0.0,0.0,29535.0,33460.0,34759285,Young Boys v Thun
2025-09-28,1823,Slovenian Premier League,100.0,100.0,29635.0,33560.0,34759367,NK Bravo v Koper
2025-09-28,1824,Swedish Superettan,0.0,0.0,29635.0,33560.0,34759379,Vasteras SK v Sandvikens
2025-09-28,1825,Swedish Superettan,100.0,100.0,29735.0,33660.0,34759380,Falkenbergs v Ostersunds FK
2025-09-28,1826,English WSL,100.0,100.0,29835.0,33760.0,34759429,Leicester City (W) v Tottenham (W)
2025-09-28,1827,Swiss Challenge League,0.0,0.0,29835.0,33760.0,34759432,Yverdon Sport v Stade Nyonnais
2025-09-28,1828,Swiss Super League,0.0,0.0,29835.0,33760.0,34759546,Sion v Lausanne
2025-09-28,1829,Swiss Super League,0.0,0.0,29835.0,33760.0,34759547,FC Basel v Luzern
2025-09-28,1830,Norwegian Eliteserien,100.0,100.0,29935.0,33860.0,34759684,Bryne v Kristiansund
2025-09-28,1831,Norwegian Eliteserien,100.0,100.0,30035.0,33960.0,34759706,Ham-Kam v Rosenborg
2025-09-28,1832,Norwegian Eliteserien,0.0,0.0,30035.0,33960.0,34759713,Tromso v Stromsgodset
2025-09-28,1833,English WSL,0.0,0.0,30035.0,33960.0,34759777,West Ham United (W) v Chelsea (W)
2025-09-28,1834,Croatian 1 HNL,0.0,0.0,30035.0,33960.0,34760009,Dinamo Zagreb v Slaven Belupo
2025-09-28,1835,German 3 Liga,100.0,100.0,30135.0,34060.0,34760407,Jahn Regensburg v Verl
2025-09-28,1836,German 3 Liga,-210.0,-210.0,29925.0,33850.0,34760408,Viktoria Koln v VfL Osnabruck
2025-09-28,1837,German 3 Liga,-260.0,-260.0,29665.0,33590.0,34760409,Hoffenheim II v SSV Ulm
