2025-08-30,1053,Swedish Division 1,100.0,100.0,19670.0,20505.0,34672779,Angelholms v Torslanda
2025-08-30,1054,Swedish Division 1,100.0,100.0,19770.0,20605.0,34672780,Eskilsminne v Rosengard
2025-08-30,1055,Swedish Division 1,-260.0,-260.0,19510.0,20345.0,34672784,Husqvarna v Ariana FC
2025-08-30,1056,Swedish Division 1,100.0,100.0,19610.0,20445.0,34672785,Skovde AIK v Oskarshamns AIK
2025-08-30,1057,English National League North,0.0,0.0,19610.0,20445.0,34672955,AFC Fylde v Bedford Town
2025-08-30,1058,Swedish Division 1,100.0,100.0,19710.0,20545.0,34673457,Karlbergs BK v IFK Haninge
2025-08-30,1059,Swedish Division 1,100.0,100.0,19810.0,20645.0,34673458,Gefle v Sollentuna FF
2025-08-30,1060,Swedish Division 1,0.0,0.0,19810.0,20645.0,34673462,FC Stockholm Internazionale v FC Arlanda
2025-08-30,1061,Icelandic 1 Deild,-280.0,-280.0,19530.0,20365.0,34675069,Volsungur v Grindavik
2025-08-30,1062,English Premier League 2 - Div 1,0.0,0.0,19530.0,20365.0,34676859,Tottenham U21 v Nottingham Forest U21
2025-08-31,1063,Greek Super League,0.0,0.0,19530.0,20365.0,34531539,AEK Athens v Asteras Tripolis
2025-08-31,1064,Greek Super League,0.0,0.0,19530.0,20365.0,34543040,Panathinaikos v Levadiakos
2025-08-31,1065,Greek Super League,0.0,0.0,19530.0,20365.0,34544318,PAOK v Atromitos
2025-08-31,1066,Dutch Eredivisie,100.0,100.0,19630.0,20465.0,34632847,Fortuna Sittard v NEC Nijmegen
2025-08-31,1067,Dutch Eredivisie,0.0,0.0,19630.0,20465.0,34632860,NAC Breda v Az Alkmaar
2025-08-31,1068,Dutch Eredivisie,100.0,100.0,19730.0,20565.0,34632921,PEC Zwolle v FC Utrecht
2025-08-31,1069,Dutch Eredivisie,100.0,100.0,19830.0,20665.0,34632922,Sparta Rotterdam v Feyenoord
2025-08-31,1070,German Bundesliga,100.0,100.0,19930.0,20765.0,34637566,FC Koln v Freiburg
2025-08-31,1071,German Bundesliga,0.0,0.0,19930.0,20765.0,34637569,Dortmund v Union Berlin
2025-08-31,1072,Brazilian Serie A,0.0,0.0,19930.0,20765.0,34641381,Flamengo v Gremio
2025-08-31,1073,Brazilian Serie A,-210.0,-210.0,19720.0,20555.0,34641382,Santos v Fluminense
2025-08-31,1074,Brazilian Serie A,-200.0,-200.0,19520.0,20355.0,34641383,Corinthians v SE Palmeiras
2025-08-31,1075,Brazilian Serie A,100.0,100.0,19620.0,20455.0,34641391,Cruzeiro MG v Sao Paulo
2025-08-31,1076,Brazilian Serie A,100.0,100.0,19720.0,20555.0,34641394,Internacional v Fortaleza EC
2025-08-31,1077,Brazilian Serie A,100.0,100.0,19820.0,20655.0,34641395,Mirassol v Bahia
2025-08-31,1078,Brazilian Serie A,100.0,100.0,19920.0,20755.0,34641417,Sport Recife v Vasco da Gama
2025-08-31,1079,French Ligue 1,0.0,0.0,19920.0,20755.0,34658970,Monaco v Strasbourg
2025-08-31,1080,French Ligue 1,100.0,100.0,20020.0,20855.0,34658971,Paris FC v Metz
2025-08-31,1081,French Ligue 1,100.0,200.0,20120.0,21055.0,34658972,Lyon v Marseille
2025-08-31,1082,French Ligue 1,100.0,100.0,20220.0,21155.0,34658973,Le Havre v Nice
2025-08-31,1083,French Ligue 1,-240.0,-240.0,19980.0,20915.0,34659175,Angers v Rennes
2025-08-31,1084,German Bundesliga 2,100.0,200.0,20080.0,21115.0,34659340,Kaiserslautern v SV Darmstadt
2025-08-31,1085,German Bundesliga 2,100.0,100.0,20180.0,21215.0,34659346,FC Magdeburg v Greuther Furth
2025-08-31,1086,Belgian First Division A,-300.0,-300.0,19880.0,20915.0,34659350,Gent v Club Brugge
2025-08-31,1087,Danish Superliga,100.0,200.0,19980.0,21115.0,34659753,Silkeborg v SonderjyskE
2025-08-31,1088,Swedish Allsvenskan,0.0,0.0,19980.0,21115.0,34659821,Malmo FF v Degerfors
2025-08-31,1089,Swiss Super League,100.0,100.0,20080.0,21215.0,34659830,Young Boys v Lugano
2025-08-31,1090,Swiss Super League,-270.0,-270.0,19810.0,20945.0,34659835,Servette v Luzern
2025-08-31,1091,Swiss Super League,100.0,200.0,19910.0,21145.0,34659836,Lausanne v St Gallen
2025-08-31,1092,Swedish Superettan,100.0,100.0,20010.0,21245.0,34659838,Umea FC v Oddevold
2025-08-31,1093,Norwegian Eliteserien,0.0,0.0,20010.0,21245.0,34659855,Kristiansund v Brann
2025-08-31,1094,Norwegian Eliteserien,0.0,0.0,20010.0,21245.0,34659914,Viking v Rosenborg
2025-08-31,1095,Norwegian Eliteserien,0.0,0.0,20010.0,21245.0,34659918,Sandefjord v Bodo Glimt
2025-08-31,1096,Swedish Superettan,0.0,0.0,20010.0,21245.0,34659922,Utsiktens v Orgryte
2025-08-31,1097,Danish Superliga,100.0,100.0,20110.0,21345.0,34659929,OB v FC Nordsjaelland
2025-08-31,1098,Norwegian Eliteserien,100.0,100.0,20210.0,21445.0,34659948,Ham-Kam v Sarpsborg
2025-08-31,1099,Norwegian Eliteserien,0.0,0.0,20210.0,21445.0,34659961,Fredrikstad v Haugesund
2025-08-31,1100,Slovenian Premier League,-250.0,-250.0,19960.0,21195.0,34659983,Mura v NK Primorje
2025-08-31,1101,Danish Superliga,100.0,100.0,20060.0,21295.0,34660057,Randers v FC Copenhagen
2025-08-31,1102,Swedish Superettan,100.0,100.0,20160.0,21395.0,34660093,IK Brage v Trelleborgs
2025-08-31,1103,Swedish Allsvenskan,0.0,0.0,20160.0,21395.0,34660120,Hammarby v Osters
2025-08-31,1104,Belgian First Division A,100.0,100.0,20260.0,21495.0,34660144,Union St Gilloise v Anderlecht
2025-08-31,1105,German 3 Liga,100.0,100.0,20360.0,21595.0,34660233,Rot-Weiss Essen v Alemannia Aachen
2025-08-31,1106,Belgian First Division A,0.0,0.0,20360.0,21595.0,34660234,Genk v Zulte-Waregem
2025-08-31,1107,Norwegian Eliteserien,100.0,100.0,20460.0,21695.0,34660236,Stromsgodset v Molde
2025-08-31,1108,Norwegian Eliteserien,100.0,100.0,20560.0,21795.0,34660238,Tromso v Kfum Oslo
2025-08-31,1109,Danish Superliga,100.0,200.0,20660.0,21995.0,34660569,Brondby v Midtjylland
2025-08-31,1110,Swedish Allsvenskan,100.0,100.0,20760.0,22095.0,34660716,Norrkoping v Djurgardens
2025-08-31,1111,Chilean Primera Division,100.0,100.0,20860.0,22195.0,34660772,Deportes Iquique v Deportes Limache
2025-08-31,1112,Chilean Primera Division,100.0,100.0,20960.0,22295.0,34660777,Nublense v Union Espanola
2025-08-31,1113,Chilean Primera Division,100.0,200.0,21060.0,22495.0,34660778,Colo Colo v Universidad de Chile
2025-08-31,1114,Slovenian Premier League,0.0,0.0,21060.0,22495.0,34660813,NK Celje v Domzale
2025-08-31,1115,Croatian 1 HNL,-229.99999999999997,-229.99999999999997,20830.0,22265.0,34660901,Hajduk Split v Rijeka
2025-08-31,1116,Venezuelan Primera Division,100.0,200.0,20930.0,22465.0,34661161,Academia Anzoategui FC v Puerto Cabello
2025-08-31,1117,German Bundesliga 2,100.0,200.0,21030.0,22665.0,34662087,Dynamo Dresden v Schalke 04
2025-08-31,1118,Cypriot 1st Division,100.0,100.0,21130.0,22765.0,34662866,AEK Larnaca v A.E.L.
2025-08-31,1119,Cypriot 1st Division,100.0,100.0,21230.0,22865.0,34662870,Ethnikos Achnas v Omonia
2025-08-31,1120,Serbian Super League,100.0,100.0,21330.0,22965.0,34663256,FK Radnicki 1923 v Radnicki Nis
2025-08-31,1121,Serbian Super League,0.0,0.0,21330.0,22965.0,34663257,FK Novi Pazar v Crvena Zvezda
2025-08-31,1122,Serbian Super League,100.0,100.0,21430.0,23065.0,34663264,FK Napredak v FK IMT Novi Beograd
2025-08-31,1123,Japanese J League 3,100.0,100.0,21530.0,23165.0,34669182,Kamatamare Sanuki v Thespakusatsu Gunma
2025-08-31,1124,German 3 Liga,100.0,100.0,21630.0,23265.0,34669509,SSV Ulm v Waldhof Mannheim
2025-08-31,1125,Swiss Challenge League,100.0,100.0,21730.0,23365.0,34670168,Yverdon Sport v Neuchatel Xamax
2025-08-31,1126,Venezuelan Primera Division,100.0,100.0,21830.0,23465.0,34671547,Deportivo Tachira v Estudiantes de Merida
2025-08-31,1127,Swedish Division 1,100.0,100.0,21930.0,23565.0,34676521,FC Trollhattan v Hassleholms IF
2025-08-31,1128,Swedish Division 1,100.0,100.0,22030.0,23665.0,34676533,Ljungskile v BK Olympic
2025-08-31,1129,Swedish Division 1,100.0,100.0,22130.0,23765.0,34676551,AFC Eskilstuna v IF Karlstad
2025-08-31,1130,Kazakhstan Premier League,0.0,0.0,22130.0,23765.0,34679609,Okzhetpes v Kairat Almaty
2025-09-01,1131,Venezuelan Primera Division,100.0,100.0,22230.0,23865.0,34671361,Caracas v Yaracuyanos
2025-09-01,1132,Swedish Division 1,0.0,0.0,22230.0,23865.0,34676855,Jonkopings Sodra v Skovde
2025-09-02,1133,Romanian Liga II,0.0,0.0,22230.0,23865.0,34675932,Chindia Targoviste v ACS Dumbravita
2025-09-02,1134,English National League North,-229.99999999999997,-229.99999999999997,22000.0,23635.0,34682861,Worksop Town v Spennymoor Town
2025-09-02,1135,English National League North,100.0,100.0,22100.0,23735.0,34682880,Scarborough Athletic v Buxton
2025-09-02,1136,English National League North,-229.99999999999997,-229.99999999999997,21870.0,23505.0,34684912,AFC Fylde v Chester
2025-09-02,1137,English National League North,100.0,100.0,21970.0,23605.0,34684952,AFC Telford v Peterborough Sports FC
2025-09-02,1138,English National League North,-300.0,-300.0,21670.0,23305.0,34684969,Hereford FC v Bedford Town
2025-09-02,1139,English National League North,100.0,100.0,21770.0,23405.0,34684970,Curzon Ashton v Chorley
2025-09-02,1140,English National League North,100.0,100.0,21870.0,23505.0,34685005,Leamington v Southport
2025-09-02,1141,English National League North,100.0,100.0,21970.0,23605.0,34685039,Marine FC v Darlington
2025-09-02,1142,English National League North,100.0,100.0,22070.0,23705.0,34685045,Oxford City v Alfreton Town
2025-09-02,1143,English National League North,0.0,0.0,22070.0,23705.0,34685052,Macclesfield v Merthyr Town
2025-09-02,1144,English National League North,100.0,100.0,22170.0,23805.0,34685053,South Shields v Radcliffe Borough
2025-09-05,1145,English WSL,0.0,0.0,22170.0,23805.0,34667115,Chelsea (W) v Man City (W)
2025-09-05,1146,Irish Division 1,-250.0,-250.0,21920.0,23555.0,34677979,Kerry FC v Cobh Ramblers
2025-09-05,1147,Irish Division 1,100.0,100.0,22020.0,23655.0,34677980,Treaty United v UCD
2025-09-05,1148,Irish Division 1,0.0,0.0,22020.0,23655.0,34677982,Bray Wanderers v Athlone Town
2025-09-05,1149,Dutch Eerste Divisie,0.0,0.0,22020.0,23655.0,34678347,De Graafschap v Emmen
2025-09-05,1150,Irish Division 1,-220.00000000000003,-220.00000000000003,21800.0,23435.0,34681191,Longford v Finn Harps
2025-09-05,1151,Irish Division 1,0.0,0.0,21800.0,23435.0,34681192,Wexford F.C v Dundalk
2025-09-05,1152,Swedish Division 1,100.0,100.0,21900.0,23535.0,34694282,Hassleholms IF v Lunds BK
2025-09-06,1153,English WSL,0.0,0.0,21900.0,23535.0,34667390,Arsenal (W) v London City Lionesses
2025-09-06,1154,English Sky Bet League 2,100.0,100.0,22000.0,23635.0,34680080,Barnet v Shrewsbury
2025-09-06,1155,English Sky Bet League 2,100.0,200.0,22100.0,23835.0,34680146,Salford City v Tranmere
2025-09-06,1156,English Sky Bet League 2,100.0,200.0,22200.0,24035.0,34680148,Newport County v Bristol Rovers
2025-09-06,1157,English Sky Bet League 2,100.0,100.0,22300.0,24135.0,34680157,Cambridge Utd v Oldham
2025-09-06,1158,English Sky Bet League 2,100.0,100.0,22400.0,24235.0,34680158,Barrow v Swindon
2025-09-06,1159,English Sky Bet League 2,-220.00000000000003,-220.00000000000003,22180.0,24015.0,34680161,Colchester v Crewe
2025-09-06,1160,English Sky Bet League 2,100.0,100.0,22280.0,24115.0,34680168,Bromley v Gillingham
2025-09-06,1161,English Sky Bet League 2,100.0,100.0,22380.0,24215.0,34680188,Harrogate Town v Crawley Town
2025-09-06,1162,English Sky Bet League 1,100.0,100.0,22480.0,24315.0,34680411,Doncaster v Bradford
2025-09-06,1163,English Sky Bet League 1,100.0,100.0,22580.0,24415.0,34680458,Wycombe v Mansfield
2025-09-06,1164,English Sky Bet League 1,100.0,100.0,22680.0,24515.0,34680502,Rotherham v Exeter
2025-09-06,1165,English Sky Bet League 1,100.0,100.0,22780.0,24615.0,34680519,Port Vale v Leyton Orient
2025-09-06,1166,English Sky Bet League 2,100.0,100.0,22880.0,24715.0,34680537,Walsall v Chesterfield
2025-09-06,1167,English Sky Bet League 1,100.0,100.0,22980.0,24815.0,34680556,Bolton v AFC Wimbledon
2025-09-06,1168,English Sky Bet League 1,-210.0,-210.0,22770.0,24605.0,34680588,Lincoln v Wigan
2025-09-06,1169,English Sky Bet League 1,0.0,0.0,22770.0,24605.0,34680601,Huddersfield v Peterborough
2025-09-06,1170,English Sky Bet League 1,100.0,100.0,22870.0,24705.0,34680613,Plymouth v Stockport
2025-09-06,1171,English Sky Bet League 2,100.0,100.0,22970.0,24805.0,34680700,Cheltenham v Accrington
2025-09-06,1172,English Sky Bet League 2,100.0,200.0,23070.0,25005.0,34680706,Notts Co v Fleetwood Town
2025-09-06,1173,English National League North,100.0,100.0,23170.0,25105.0,34694124,Buxton v Oxford City
2025-09-06,1174,English National League North,-225.0,-225.0,22945.0,24880.0,34694125,Alfreton Town v Kings Lynn
2025-09-06,1175,English National League North,100.0,100.0,23045.0,24980.0,34694127,Chorley v AFC Telford
2025-09-06,1176,English National League North,100.0,100.0,23145.0,25080.0,34694130,Spennymoor Town v Leamington
2025-09-06,1177,English National League North,100.0,100.0,23245.0,25180.0,34694131,Kidderminster v Macclesfield
2025-09-06,1178,English National League North,-229.99999999999997,-229.99999999999997,23015.0,24950.0,34694132,Darlington v Hereford FC
2025-09-06,1179,English National League North,100.0,100.0,23115.0,25050.0,34694135,Peterborough Sports FC v AFC Fylde
2025-09-06,1180,English National League North,-275.0,-275.0,22840.0,24775.0,34694138,Southport v South Shields
2025-09-06,1181,English National League North,-229.99999999999997,-229.99999999999997,22610.0,24545.0,34694139,Chester v Scarborough Athletic
2025-09-06,1182,English National League North,100.0,100.0,22710.0,24645.0,34694140,Merthyr Town v Worksop Town
2025-09-06,1183,English National League North,-210.0,-210.0,22500.0,24435.0,34694141,Bedford Town v Curzon Ashton
2025-09-06,1184,Swedish Division 1,100.0,100.0,22600.0,24535.0,34697598,FC Arlanda v AFC Eskilstuna
2025-09-06,1185,Swedish Division 1,100.0,100.0,22700.0,24635.0,34697599,Gefle v IFK Haninge
2025-09-06,1186,Swedish Division 1,100.0,100.0,22800.0,24735.0,34697603,Sollentuna FF v Orebro Syrianska
2025-09-06,1187,Swedish Division 1,0.0,0.0,22800.0,24735.0,34697604,Karlbergs BK v IFK Stocksund
2025-09-06,1188,Japanese J League 3,100.0,200.0,22900.0,24935.0,34697674,Kitakyushu v FC Gifu
2025-09-06,1189,Japanese J League 3,100.0,100.0,23000.0,25035.0,34697676,FC Ryukyu v Thespakusatsu Gunma
2025-09-06,1190,Japanese J League 3,0.0,0.0,23000.0,25035.0,34697677,Kagoshima Utd v Kochi Univ
2025-09-06,1191,Japanese J League 3,100.0,100.0,23100.0,25135.0,34697679,Vanraure Hachinohe v Azul Claro Numazu
2025-09-06,1192,Japanese J League 3,100.0,100.0,23200.0,25235.0,34697680,Tegevajaro Miyazaki v Tochigi SC
2025-09-06,1193,Japanese J League 3,100.0,200.0,23300.0,25435.0,34697681,Nara Club v Kamatamare Sanuki
2025-09-06,1194,Japanese J League 3,-229.99999999999997,-229.99999999999997,23070.0,25205.0,34697682,Tottori v Fukushima Utd
2025-09-06,1195,Icelandic 1 Deild,100.0,100.0,23170.0,25305.0,34697792,HK Kopavogur v Throttur
2025-09-06,1196,Swedish Division 1,100.0,100.0,23270.0,25405.0,34697793,Skovde v Torslanda
2025-09-06,1197,Icelandic 1 Deild,-275.0,-275.0,22995.0,25130.0,34697795,Keflavik v Njardvik
2025-09-06,1198,Icelandic 1 Deild,0.0,0.0,22995.0,25130.0,34697796,Fylkir v Volsungur
2025-09-06,1199,Swedish Division 1,-229.99999999999997,-229.99999999999997,22765.0,24900.0,34698502,Angelholms v Rosengard
2025-09-06,1200,Swedish Division 1,100.0,100.0,22865.0,25000.0,34698508,Oskarshamns AIK v Husqvarna
2025-09-06,1201,Icelandic 1 Deild,0.0,0.0,22865.0,25000.0,34698510,Grindavik v IR Reykjavik
2025-09-06,1202,Icelandic 1 Deild,100.0,100.0,22965.0,25100.0,34698511,Leiknir R v Selfoss
2025-09-06,1203,Swedish Division 1,100.0,100.0,23065.0,25200.0,34698541,FC Trollhattan v Eskilsminne
2025-09-06,1204,Norwegian 2nd Division,0.0,0.0,23065.0,25200.0,34701814,Floy Flekkeroy v Notodden
2025-09-06,1205,Norwegian 2nd Division,0.0,0.0,23065.0,25200.0,34701823,Strindheim v Asker
2025-09-06,1206,Norwegian 2nd Division,-280.0,-280.0,22785.0,24920.0,34701829,Ullensaker Kisa v Stjordals-Blink
2025-09-06,1207,Norwegian 2nd Division,100.0,100.0,22885.0,25020.0,34701833,Grorud IL v Levanger
2025-09-06,1208,Norwegian 2nd Division,0.0,0.0,22885.0,25020.0,34701856,Brann II v Lysekloster
2025-09-06,1209,Norwegian 2nd Division,0.0,0.0,22885.0,25020.0,34701874,Strommen v Alta
2025-09-06,1210,Norwegian 2nd Division,0.0,0.0,22885.0,25020.0,34701876,Follo v Eidsvold Turn
2025-09-06,1211,Northern Irish Premiership,0.0,0.0,22885.0,25020.0,34705255,Ballymena v Glentoran
2025-09-06,1212,Northern Irish Premiership,0.0,0.0,22885.0,25020.0,34705266,Bangor v Larne
2025-09-06,1213,Northern Irish Premiership,0.0,0.0,22885.0,25020.0,34705268,Carrick Rangers v Cliftonville
2025-09-06,1214,Northern Irish Premiership,0.0,0.0,22885.0,25020.0,34705272,Crusaders v Coleraine
2025-09-06,1215,Northern Irish Premiership,0.0,0.0,22885.0,25020.0,34705275,Glenavon v Dungannon
2025-09-06,1216,Northern Irish Premiership,0.0,0.0,22885.0,25020.0,34705278,Linfield v Portadown
2025-09-07,1217,English WSL,100.0,100.0,22985.0,25120.0,34667131,Liverpool (W) v Everton (W)
2025-09-07,1218,English WSL,-270.0,-270.0,22715.0,24850.0,34667140,Brighton (W) v Aston Villa (W)
2025-09-07,1219,Chilean Primera Division,100.0,100.0,22815.0,24950.0,34684518,Cobresal v Palestino
2025-09-07,1220,Swedish Division 1,100.0,100.0,22915.0,25050.0,34697624,FC Stockholm Internazionale v United IK Nordic
2025-09-07,1221,Swedish Division 1,100.0,100.0,23015.0,25150.0,34697689,Assyriska FF v IF Karlstad
2025-09-07,1222,Japanese J League 3,100.0,100.0,23115.0,25250.0,34698514,Kanazawa v FC Osaka
2025-09-07,1223,Swedish Division 1,-229.99999999999997,-229.99999999999997,22885.0,25020.0,34698707,BK Olympic v Jonkopings Sodra
2025-09-07,1224,Norwegian 2nd Division,100.0,100.0,22985.0,25120.0,34701816,Sotra SK v Arendal
2025-09-07,1225,Norwegian 2nd Division,100.0,100.0,23085.0,25220.0,34701839,Traeff v Sandnes Ulf
2025-09-07,1226,Norwegian 2nd Division,100.0,100.0,23185.0,25320.0,34701840,Jerv v Brattvag
2025-09-11,1227,Indonesian Super League,100.0,100.0,23285.0,25420.0,34697579,Semen Padang v PSBS Biak Numfor
2025-09-11,1228,Indonesian Super League,100.0,100.0,23385.0,25520.0,34698843,Persita Tangerang v PSM Makassar
2025-09-11,1229,Romanian Liga II,100.0,100.0,23485.0,25620.0,34713535,FC Voluntari v Concordia Chiajna
2025-09-11,1230,Romanian Liga II,100.0,100.0,23585.0,25720.0,34714370,CSA Steaua Bucuresti v ASA Targu Mures
2025-09-12,1231,German Bundesliga,0.0,0.0,23585.0,25720.0,34659786,Leverkusen v Eintracht Frankfurt
2025-09-12,1232,Bolivian Liga de Futbol Profesional,100.0,200.0,23685.0,25920.0,34663322,Universitario de Vinto v Real Tomayapo
2025-09-12,1233,French Ligue 1,0.0,0.0,23685.0,25920.0,34683130,Marseille v Lorient
2025-09-12,1234,Danish Superliga,100.0,200.0,23785.0,26120.0,34685316,Sonderjyske v Randers
2025-09-12,1235,Norwegian Eliteserien,0.0,0.0,23785.0,26120.0,34685353,Bodo Glimt v Kristiansund
2025-09-12,1236,German Bundesliga 2,100.0,200.0,23885.0,26320.0,34687536,Arminia Bielefeld v FC Magdeburg
2025-09-12,1237,Dutch Eerste Divisie,-270.0,-270.0,23615.0,26050.0,34691001,De Graafschap v Willem II
2025-09-12,1238,Dutch Eerste Divisie,100.0,200.0,23715.0,26250.0,34691027,FC Eindhoven v ADO Den Haag
2025-09-12,1239,Dutch Eerste Divisie,0.0,0.0,23715.0,26250.0,34691033,Emmen v FC Oss
2025-09-12,1240,Dutch Eerste Divisie,0.0,0.0,23715.0,26250.0,34691043,Den Bosch v FC Dordrecht
2025-09-12,1241,Dutch Eerste Divisie,0.0,0.0,23715.0,26250.0,34691053,Jong FC Utrecht v RKC Waalwijk
2025-09-12,1242,German 3 Liga,100.0,100.0,23815.0,26350.0,34693951,Jahn Regensburg v Rot-Weiss Essen
2025-09-12,1243,Chilean Primera Division,0.0,0.0,23815.0,26350.0,34703090,Union La Calera v Everton De Vina
2025-09-12,1244,Chilean Primera Division,0.0,0.0,23815.0,26350.0,34703091,Coquimbo Unido v Nublense
2025-09-12,1245,Saudi Professional League,0.0,0.0,23815.0,26350.0,34703226,Al-Ettifaq v Al Ahli
2025-09-12,1246,Irish Division 1,0.0,0.0,23815.0,26350.0,34703422,Cobh Ramblers v Treaty United
2025-09-12,1247,Irish Division 1,0.0,0.0,23815.0,26350.0,34703423,UCD v Longford
2025-09-12,1248,Irish Division 1,0.0,0.0,23815.0,26350.0,34703425,Dundalk v Bray Wanderers
2025-09-12,1249,Swiss Challenge League,100.0,100.0,23915.0,26450.0,34703475,Etoile Carouge v Yverdon Sport
2025-09-12,1250,Swiss Challenge League,100.0,100.0,24015.0,26550.0,34703476,Stade Nyonnais v Stade Lausanne-Ouchy
2025-09-12,1251,Belgian First Division B,0.0,0.0,24015.0,26550.0,34706939,Anderlecht B v KFCO Beerschot Wilrijk
2025-09-12,1252,Saudi Professional League,0.0,0.0,24015.0,26550.0,34707309,Al-Ittihad v Al-Fateh (KSA)
2025-09-12,1253,Indonesian Super League,100.0,100.0,24115.0,26650.0,34709071,Persib Bandung v Persebaya Surabaya
2025-09-12,1254,English WSL,0.0,0.0,24115.0,26650.0,34709241,West Ham United (W) v Arsenal (W)
2025-09-12,1255,English WSL,0.0,0.0,24115.0,26650.0,34716114,Man City (W) v Brighton (W)
2025-09-12,1256,Indonesian Super League,-220.00000000000003,-220.00000000000003,23895.0,26430.0,34716730,Madura Utd v Bhayangkara FC
2025-09-12,1257,Lithuanian 1 Lyga,0.0,0.0,23895.0,26430.0,34717885,FK Panevezio Ekranas v TransINVEST Vilnius
2025-09-12,1258,Venezuelan Primera Division,0.0,0.0,23895.0,26430.0,34720294,Metropolitanos v Estudiantes de Merida
2025-09-12,1259,Venezuelan Primera Division,0.0,0.0,23895.0,26430.0,34720852,Yaracuyanos v Academia Anzoategui FC
2025-09-12,1260,Jordanian Premier League,0.0,0.0,23895.0,26430.0,34721834,Al-Jazeera v Al Wehdat
2025-09-12,1261,Chilean Segunda Division,0.0,0.0,23895.0,26430.0,34723321,CSD San Antonio Unido v CD Trasandino
2025-09-12,1262,Northern Irish Premiership,-210.0,-210.0,23685.0,26220.0,34724998,Glentoran v Linfield
2025-09-13,1263,Dutch Eredivisie,0.0,0.0,23685.0,26220.0,34659443,Ajax v PEC Zwolle
2025-09-13,1264,Dutch Eredivisie,0.0,0.0,23685.0,26220.0,34659470,FC Twente v NAC Breda
2025-09-13,1265,German Bundesliga,0.0,0.0,23685.0,26220.0,34659774,Bayern Munich v Hamburger SV
2025-09-13,1266,German Bundesliga,0.0,0.0,23685.0,26220.0,34659777,Wolfsburg v FC Koln
2025-09-13,1267,German Bundesliga,0.0,0.0,23685.0,26220.0,34659781,Union Berlin v Hoffenheim
2025-09-13,1268,German Bundesliga,0.0,0.0,23685.0,26220.0,34659782,FC Heidenheim v Dortmund
2025-09-13,1269,German Bundesliga,0.0,0.0,23685.0,26220.0,34659787,Freiburg v Stuttgart
2025-09-13,1270,German Bundesliga,0.0,0.0,23685.0,26220.0,34659792,Mainz v RB Leipzig
2025-09-13,1271,Greek Super League,0.0,0.0,23685.0,26220.0,34659860,Olympiakos v Panserraikos
2025-09-13,1272,Dutch Eredivisie,0.0,0.0,23685.0,26220.0,34659900,Go Ahead Eagles v FC Volendam
2025-09-13,1273,Dutch Eredivisie,0.0,0.0,23685.0,26220.0,34659920,Feyenoord v Heerenveen
2025-09-13,1274,Brazilian Serie A,0.0,0.0,23685.0,26220.0,34661162,Gremio v Mirassol
2025-09-13,1275,Brazilian Serie A,0.0,0.0,23685.0,26220.0,34661193,SE Palmeiras v Internacional
2025-09-13,1276,Bolivian Liga de Futbol Profesional,100.0,100.0,23785.0,26320.0,34663203,Aurora v The Strongest
2025-09-13,1277,Bolivian Liga de Futbol Profesional,0.0,0.0,23785.0,26320.0,34663273,Oriente Petrolero v CDT Real Oruro
2025-09-13,1278,Bolivian Liga de Futbol Profesional,0.0,0.0,23785.0,26320.0,34663317,Nacional Potosi v San Antonio Bulo Bulo
2025-09-13,1279,Bolivian Liga de Futbol Profesional,0.0,0.0,23785.0,26320.0,34664306,Bolivar v Guabira
2025-09-13,1280,Scottish League One,0.0,0.0,23785.0,26320.0,34682387,Cove Rangers v Inverness CT
2025-09-13,1281,Scottish League One,0.0,0.0,23785.0,26320.0,34682408,Kelty Hearts v Stenhousemuir
2025-09-13,1282,Scottish League One,0.0,0.0,23785.0,26320.0,34682424,East Fife v Queen of South
2025-09-13,1283,French Ligue 1,0.0,0.0,23785.0,26320.0,34683103,Nice v Nantes
2025-09-13,1284,French Ligue 1,0.0,0.0,23785.0,26320.0,34683110,Auxerre v Monaco
2025-09-13,1285,Swedish Allsvenskan,0.0,0.0,23785.0,26320.0,34685296,Degerfors v Mjallby
2025-09-13,1286,Swedish Allsvenskan,0.0,0.0,23785.0,26320.0,34685302,Halmstads v Norrkoping
2025-09-13,1287,German Bundesliga 2,0.0,0.0,23785.0,26320.0,34685326,SV Darmstadt v Braunschweig
2025-09-13,1288,Danish Superliga,0.0,0.0,23785.0,26320.0,34685340,Brondby v FC Copenhagen
2025-09-13,1289,Norwegian Eliteserien,0.0,0.0,23785.0,26320.0,34685343,Molde v Fredrikstad
2025-09-13,1290,Norwegian Eliteserien,0.0,0.0,23785.0,26320.0,34685367,Brann v Valerenga
2025-09-13,1291,German Bundesliga 2,0.0,0.0,23785.0,26320.0,34687528,Schalke 04 v Holstein Kiel
2025-09-13,1292,Serbian Super League,0.0,0.0,23785.0,26320.0,34688268,Radnik Surdulica v FK Radnicki 1923
2025-09-13,1293,Serbian Super League,0.0,0.0,23785.0,26320.0,34688269,Vojvodina v Cukaricki
2025-09-13,1294,Serbian Super League,0.0,0.0,23785.0,26320.0,34689648,OFK Beograd v FK Novi Pazar
2025-09-13,1295,Dutch Eerste Divisie,0.0,0.0,23785.0,26320.0,34691038,VVV Venlo v Helmond Sport
2025-09-13,1296,Swedish Superettan,0.0,0.0,23785.0,26320.0,34691388,Oddevold v IK Brage
2025-09-13,1297,Swedish Superettan,0.0,0.0,23785.0,26320.0,34691389,Sundsvall v Varbergs BoIS
2025-09-13,1298,Swedish Superettan,0.0,0.0,23785.0,26320.0,34691391,Falkenbergs v Utsiktens
2025-09-13,1299,Swedish Superettan,0.0,0.0,23785.0,26320.0,34691394,Orebro v Ostersunds FK
2025-09-13,1300,German 3 Liga,0.0,0.0,23785.0,26320.0,34693952,Alemannia Aachen v SSV Ulm
2025-09-13,1301,German 3 Liga,0.0,0.0,23785.0,26320.0,34693953,Stuttgart II v Saarbrucken
2025-09-13,1302,German 3 Liga,0.0,0.0,23785.0,26320.0,34693955,Ingolstadt v Schweinfurt
2025-09-13,1303,German 3 Liga,0.0,0.0,23785.0,26320.0,34693964,Erzgebirge v Viktoria Koln
2025-09-13,1304,Belgian First Division A,0.0,0.0,23785.0,26320.0,34694144,FCV Dender v Union St Gilloise
2025-09-13,1305,Belgian First Division A,0.0,0.0,23785.0,26320.0,34694154,RAAL La Louviere v Club Brugge
2025-09-13,1306,Belgian First Division A,0.0,0.0,23785.0,26320.0,34694156,Zulte-Waregem v Oud-Heverlee Leuven
2025-09-13,1307,Croatian 1 HNL,0.0,0.0,23785.0,26320.0,34694202,Varazdin v Hajduk Split
2025-09-13,1308,Swiss Super League,0.0,0.0,23785.0,26320.0,34694418,FC Zurich v Servette
2025-09-13,1309,Chilean Primera Division,0.0,0.0,23785.0,26320.0,34703177,Deportes Limache v Univ Catolica (Chile)
2025-09-13,1310,Chilean Primera Division,0.0,0.0,23785.0,26320.0,34703179,Union Espanola v Audax Italiano
2025-09-13,1311,Chilean Primera Division,0.0,0.0,23785.0,26320.0,34703180,Palestino v OHiggins
